{
  "id": "saderat",
  "name_fa": "بانک صادرات ایران",
  "name_en": "Bank Saderat Iran",
  "card_prefixes": ["603769"],
  "senders": ["SADERAT", "BSI", "+98200019"],
  "detect_regex": "(صادرات|saderat|bsi)",
  "deposit_regex": "واریز[:\\s]*(?<amount>\\d+)\\s*ریال",
  "withdraw_regex": "برداشت[:\\s]*(?<amount>\\d+)\\s*ریال",
  "card_regex": "کارت[:\\s]*(?<card>\\d{4})",
  "balance_regex": "مانده[:\\s]*(?<balance>\\d+)",
  "sample_sms": [
    {
      "type": "DEPOSIT",
      "raw": "بانک صادرات ایران\nواریز: ۵٬۰۰۰٬۰۰۰ ریال\nکارت: ۴۴۳۳\nمانده: ۱۰۵٬۰۰۰٬۰۰۰ ریال",
      "expected_amount_rial": 5000000,
      "expected_card_last4": "4433",
      "expected_balance_rial": 105000000
    }
  ]
}
