{
  "id": "keshavarzi",
  "name_fa": "بانک کشاورزی",
  "name_en": "Keshavarzi Bank",
  "card_prefixes": ["603770", "639217"],
  "senders": ["KESHAVARZI", "AgriBank", "+98200016"],
  "detect_regex": "(کشاورزی|keshavarzi|agribank)",
  "deposit_regex": "واریز[:\\s]*(?<amount>\\d+)\\s*ریال",
  "withdraw_regex": "برداشت[:\\s]*(?<amount>\\d+)\\s*ریال",
  "card_regex": "(کارت|حساب)[:\\s]*(?<card>\\d{4})",
  "balance_regex": "مانده[:\\s]*(?<balance>\\d+)",
  "sample_sms": [
    {
      "type": "DEPOSIT",
      "raw": "بانک کشاورزی\nواریز: ۴٬۲۰۰٬۰۰۰ ریال\nحساب: ۸۸۹۰\nمانده: ۶۱٬۵۰۰٬۰۰۰ ریال",
      "expected_amount_rial": 4200000,
      "expected_card_last4": "8890",
      "expected_balance_rial": 61500000
    }
  ]
}
