{
  "id": "saman",
  "name_fa": "بانک سامان",
  "name_en": "Saman Bank",
  "card_prefixes": ["621986"],
  "senders": ["SAMAN", "SamanBank", "+9820008"],
  "detect_regex": "(سامان|saman)",
  "deposit_regex": "واریز(\\s*مبلغ)?[:\\s]*(?<amount>\\d+)\\s*ریال",
  "withdraw_regex": "برداشت(\\s*مبلغ)?[:\\s]*(?<amount>\\d+)\\s*ریال",
  "card_regex": "(کارت|سپرده)[:\\s]*(?<card>\\d{4})",
  "balance_regex": "موجودی[:\\s]*(?<balance>\\d+)",
  "sample_sms": [
    {
      "type": "DEPOSIT",
      "raw": "بانک سامان\nواریز مبلغ: ۳٬۰۰۰٬۰۰۰ ریال\nکارت: ۱۱۴۴\nمانده: ۷۰٬۰۰۰٬۰۰۰ ریال",
      "expected_amount_rial": 3000000,
      "expected_card_last4": "1144",
      "expected_balance_rial": 70000000
    }
  ]
}
