{
  "id": "pasargad",
  "name_fa": "بانک پاسارگاد",
  "name_en": "Bank Pasargad",
  "card_prefixes": ["502229", "639347"],
  "senders": ["PASARGAD", "BPI", "+981000900"],
  "detect_regex": "(پاسارگاد|pasargad|bpi)",
  "deposit_regex": "واریز[:\\s]*(?<amount>\\d+)\\s*ریال",
  "withdraw_regex": "برداشت[:\\s]*(?<amount>\\d+)\\s*ریال",
  "card_regex": "(کارت|حساب)[:\\s]*(?<card>\\d{4})",
  "balance_regex": "موجودی[:\\s]*(?<balance>\\d+)",
  "sample_sms": [
    {
      "type": "DEPOSIT",
      "raw": "بانک پاسارگاد\nواریز: ۱۰٬۰۰۰٬۰۰۰ ریال\nکارت: ۹۹۸۸\nموجودی: ۲۵۰٬۰۰۰٬۰۰۰ ریال\nکد پیگیری: ۵۵۴۴۳۳",
      "expected_amount_rial": 10000000,
      "expected_card_last4": "9988",
      "expected_balance_rial": 250000000
    }
  ]
}
