{
  "id": "refah",
  "name_fa": "بانک رفاه کارگران",
  "name_en": "Refah Bank",
  "card_prefixes": ["589463"],
  "senders": ["REFAH", "BankRefah", "+98200022"],
  "detect_regex": "(رفاه|refah)",
  "deposit_regex": "واریز[:\\s]*(?<amount>\\d+)\\s*ریال",
  "withdraw_regex": "برداشت[:\\s]*(?<amount>\\d+)\\s*ریال",
  "card_regex": "کارت[:\\s]*(?<card>\\d{4})",
  "balance_regex": "موجودی[:\\s]*(?<balance>\\d+)",
  "sample_sms": [
    {
      "type": "DEPOSIT",
      "raw": "بانک رفاه کارگران\nواریز: ۳٬۱۰۰٬۰۰۰ ریال\nکارت: ۲۳۲۳\nموجودی: ۵۲٬۰۰۰٬۰۰۰ ریال",
      "expected_amount_rial": 3100000,
      "expected_card_last4": "2323",
      "expected_balance_rial": 52000000
    }
  ]
}
