{
  "id": "postbank",
  "name_fa": "پست بانک ایران",
  "name_en": "Post Bank of Iran",
  "card_prefixes": ["627760"],
  "senders": ["POSTBANK", "PostBank", "+98200025"],
  "detect_regex": "(پست.*بانک|postbank)",
  "deposit_regex": "واریز[:\\s]*(?<amount>\\d+)\\s*ریال",
  "withdraw_regex": "برداشت[:\\s]*(?<amount>\\d+)\\s*ریال",
  "card_regex": "کارت[:\\s]*(?<card>\\d{4})",
  "balance_regex": "موجودی[:\\s]*(?<balance>\\d+)",
  "sample_sms": [
    {
      "type": "DEPOSIT",
      "raw": "پست بانک ایران\nواریز: ۱٬۱۰۰٬۰۰۰ ریال\nکارت: ۳۴۵۶\nموجودی: ۱۵٬۰۰۰٬۰۰۰ ریال",
      "expected_amount_rial": 1100000,
      "expected_card_last4": "3456",
      "expected_balance_rial": 15000000
    }
  ]
}
